{
  "language": "en",
  "lookup": "population",
  "name": "Population Forecast",
  "payload": [
    {
      "description": "The population in 2022 of Bitterfeld-Wolfen was 39,103 inhabitants. The entire ABW region had 370,190 inhabitants at that time. The following chart shows a forecast of the population development for the years 2022, 2030, and 2045.",
      "id": 2,
      "name": "Bitterfeld-Wolfen",
      "series": {
        "definition": {
          "key": {
            "lookup": "year",
            "name": "Year"
          },
          "value": {
            "lookup": "population",
            "name": "Population"
          }
        },
        "items": [
          {
            "key": 2022,
            "value": 39103
          },
          {
            "key": 2030,
            "value": 42212
          },
          {
            "key": 2045,
            "value": 45768
          }
        ]
      }
    },
    {
      "description": "The population in 2022 of Sandersdorf-Brehna was 14,468 inhabitants. The entire ABW region had 370,190 inhabitants at that time. The following chart shows a forecast of the population development for the years 2022, 2030, and 2045.",
      "id": 7,
      "name": "Sandersdorf-Brehna",
      "series": {
        "definition": {
          "key": {
            "lookup": "year",
            "name": "Year"
          },
          "value": {
            "lookup": "population",
            "name": "Population"
          }
        },
        "items": [
          {
            "key": 2022,
            "value": 14468
          },
          {
            "key": 2030,
            "value": 15132
          },
          {
            "key": 2045,
            "value": 14912
          }
        ]
      }
    },
    {
      "description": "The population in 2022 of Z\u00f6rbig was 9,311 inhabitants. The entire ABW region had 370,190 inhabitants at that time. The following chart shows a forecast of the population development for the years 2022, 2030, and 2045.",
      "id": 12,
      "name": "Z\u00f6rbig",
      "series": {
        "definition": {
          "key": {
            "lookup": "year",
            "name": "Year"
          },
          "value": {
            "lookup": "population",
            "name": "Population"
          }
        },
        "items": [
          {
            "key": 2022,
            "value": 9311
          },
          {
            "key": 2030,
            "value": 9182
          },
          {
            "key": 2045,
            "value": 8903
          }
        ]
      }
    }
  ]
}
